{"anomalies":[],"campaign":"15fbc018c1ad7fe5245313ab017624f8010442989b9f0dbc9d4c23211a875eae","format":"cubeproof-certificate-1","formula_open":[{"node":{"cube":[-1],"formula_sha256":"ac42a371b5a124286c410ed5dfa2e3be7ee7d5b1feac6f08e7e1715f0c3669a8"},"node_id":"e786a0bab7f94b78db069e8e3f4e42ec6b671af257b5eaf4a17b74c576be1f9f","reason":null,"state":"pending"}],"formulas":[{"formula_sha256":"ac42a371b5a124286c410ed5dfa2e3be7ee7d5b1feac6f08e7e1715f0c3669a8","key":"unsat","proved":false,"roots":[{"closed":false,"cube":[],"summary":{"leaf_merkle_root":null,"leaves":0,"max_cube_size":0,"splits":0}}],"summary":{"leaf_merkle_root":null,"leaves":0,"max_cube_size":0,"splits":0}}],"journals":[{"bytes":3605,"head":"d6a7fce91732d74a1211e9ff44917d285a9a23e3889e1974ae7d3e884ae166a4","id":"50dae22c5ecdb5c240cc55e710df0477d181296f684d7e0a1255ed08e453e198","records":2,"torn_tail_bytes":0,"worker":"w1"}],"machinery":[],"models":[],"not_admitted":[],"open":[{"node":{"cube":[-1],"formula_sha256":"ac42a371b5a124286c410ed5dfa2e3be7ee7d5b1feac6f08e7e1715f0c3669a8"},"node_id":"e786a0bab7f94b78db069e8e3f4e42ec6b671af257b5eaf4a17b74c576be1f9f","reason":null,"state":"pending"}],"used_attempts":[],"verdict":"OPEN"}
