{"anomalies":[],"campaign":"6bbdf19d39dd618713ca566001500c54a41a22ecac2e270c9a17fe6ad60ab0aa","format":"cubeproof-certificate-1","formula_open":[],"formulas":[{"formula_sha256":"83ef822c62746022fb52b0d52f6050c2f8a699e171512c9eb61356bda5d553d4","key":"all3","proved":true,"roots":[{"closed":true,"cube":[],"summary":{"leaf_merkle_root":"ea75d13e91612f83a945183184f3f4a6bdcf294129bb09f82754c82b01d0fa0d","leaves":3,"max_cube_size":2,"splits":2}}],"summary":{"leaf_merkle_root":"ea75d13e91612f83a945183184f3f4a6bdcf294129bb09f82754c82b01d0fa0d","leaves":3,"max_cube_size":2,"splits":2}}],"journals":[{"bytes":6776,"head":"7fba048d0bb5015b756de6981aae2855a4cdc7f5155201b6770d51f596603d2d","id":"9b120856cbbcc4e7b6f25df7fecb9ea89c8b3c0cac8c5fa43d82e872bedfed61","records":5,"torn_tail_bytes":0,"worker":"w1"}],"machinery":[{"journal":"9b120856cbbcc4e7b6f25df7fecb9ea89c8b3c0cac8c5fa43d82e872bedfed61","machinery":{"checker":{"path":"/opt/tools/bin/cake_lpr","sha256":"cb07a41e1dbd374a9ce87fb7860c564ac8e49659974253a61f9d96d3f338ef0f"},"cubeproof_sha256":"1077ed65075b150733b738cc8c5f44018162a7a7c023161dd928f5079c98f735","helper":null,"packages_sha256":"e5f20d42ac124c52b579e03661603ed3312b65548350b28285c905fe49e6ab11","runtime":{"image_digest":null,"libc":"glibc 2.39","platform":"linux-x86_64","python":"3.12.3"},"solver":{"argv":["--lrat"],"path":"/opt/tools/bin/cadical","sha256":"ed4d6e88b3adcaab6f51494a5c45b3a0d9d653dced766d1ad3d39fe00d907416","version":"1.9.5"},"source_manifest":[{"path":"cubeproof/__init__.py","sha256":"e6d1b76211276933852eb84dcab2f14504532eef4aaaac2a6e516aa8d7ffc3ae"},{"path":"cubeproof/evidence/certify.py","sha256":"4a402433c0bf4f920cd79ce3bf490d480a2a7fc78873742fb46b2967dc77cdd7"},{"path":"faces12_campaign/__init__.py","sha256":"ddeb9c4488790fd47bc51bb6a3613bd00c5aa4c8c3b93a44699d755d28d4b72e"},{"path":"neighbourly/__init__.py","sha256":"f1ec3bc0a9014c6ec5b92c85d776079ee5c74dc30327faffd4d09fbe3290d1eb"}],"unit_algorithm":"unit-v1"},"snapshot_seq":0}],"models":[],"not_admitted":[],"open":[],"used_attempts":[{"cnf_sha256":"0469a5490dc6582ad42d1f86bb4d532aeb8f8a1931b220afc3a5462aa2fb73b3","node":{"cube":[-1,2],"formula_sha256":"83ef822c62746022fb52b0d52f6050c2f8a699e171512c9eb61356bda5d553d4"},"node_id":"742e8f2941186a86b7f7e3c4386b3d29cb0629cf5b9e78501cb63a98058c6bd1","proof_sha256":"7e54a099896bf5a556192146f217a67723f7a0bdec0d4022d6b475bff90d961b","record":{"journal":"9b120856cbbcc4e7b6f25df7fecb9ea89c8b3c0cac8c5fa43d82e872bedfed61","seq":3},"route":"unit"},{"cnf_sha256":"26655321063bbc05f39d094ac442a6232b71074b27c11537354e3be78d8f86d2","node":{"cube":[1],"formula_sha256":"83ef822c62746022fb52b0d52f6050c2f8a699e171512c9eb61356bda5d553d4"},"node_id":"95757059a8564a7fddcbc2d3bff92b5425a2e31ec57681f863fc70f3fbc286ae","proof_sha256":"b5c0a80b27ce9372ef174b5ef0e34da5559b2bed3859b998f10b19828129ffd7","record":{"journal":"9b120856cbbcc4e7b6f25df7fecb9ea89c8b3c0cac8c5fa43d82e872bedfed61","seq":2},"route":"cdcl"},{"cnf_sha256":"53fa5cb71b0e56f437ce6f41646aa2cca7a60fc2aa3a3db38846f1b2f8f05c37","node":{"cube":[-1,-2],"formula_sha256":"83ef822c62746022fb52b0d52f6050c2f8a699e171512c9eb61356bda5d553d4"},"node_id":"9de4714e67983cc51bec50ac96bc0b78ace24cd172b34e873c796c892fb37dca","proof_sha256":"f30ebb9dd7f42a083e02f7e5569287646c6411cb1eb4e219f11002c1e8d00656","record":{"journal":"9b120856cbbcc4e7b6f25df7fecb9ea89c8b3c0cac8c5fa43d82e872bedfed61","seq":4},"route":"unit"}],"verdict":"PROVED"}
