{"anomalies":[{"code":"mislabelled_model","info":{},"record":{"journal":"5c4373aa6a0f0a7448fa58e69d36038618c7024f068d0d693254f01899a85cb0","seq":1}},{"code":"invalid_model","info":{"model_error":"violated"},"record":{"journal":"5c4373aa6a0f0a7448fa58e69d36038618c7024f068d0d693254f01899a85cb0","seq":2}},{"code":"invalid_model","info":{"model_error":"violated"},"record":{"journal":"5c4373aa6a0f0a7448fa58e69d36038618c7024f068d0d693254f01899a85cb0","seq":3}}],"campaign":"805589004d2ed7a54804bd0119466e76f264d65e218f86faaf70835a360147aa","format":"cubeproof-certificate-1","formula_open":[{"node":{"cube":[],"formula_sha256":"83ef822c62746022fb52b0d52f6050c2f8a699e171512c9eb61356bda5d553d4"},"node_id":"5e1fff6f071fe019657a52a5fda90a3e08196d01524e7a157b70df624b676720","reason":null,"state":"pending"},{"node":{"cube":[],"formula_sha256":"a8b2a31c8dd8ba69dd9f6b5e97792081572d2984d3ae40dcc4a6e40631427c98"},"node_id":"32f9fbd9d8fd74e216f2fe77b03491948848c3a5555a1700c217f65ab18a0090","reason":null,"state":"model"}],"formulas":[{"formula_sha256":"83ef822c62746022fb52b0d52f6050c2f8a699e171512c9eb61356bda5d553d4","key":"all3","proved":false,"roots":[{"closed":false,"cube":[],"summary":{"leaf_merkle_root":null,"leaves":0,"max_cube_size":0,"splits":0}}],"summary":{"leaf_merkle_root":null,"leaves":0,"max_cube_size":0,"splits":0}},{"formula_sha256":"a8b2a31c8dd8ba69dd9f6b5e97792081572d2984d3ae40dcc4a6e40631427c98","key":"sat3","proved":false,"roots":[{"closed":false,"cube":[],"summary":{"leaf_merkle_root":null,"leaves":0,"max_cube_size":0,"splits":0}}],"summary":{"leaf_merkle_root":null,"leaves":0,"max_cube_size":0,"splits":0}}],"journals":[{"bytes":5962,"head":"e65ccb962cf1aac608a8887911e829e2ebc7420efd7f1593a4a46e0238b9adb6","id":"5c4373aa6a0f0a7448fa58e69d36038618c7024f068d0d693254f01899a85cb0","records":4,"torn_tail_bytes":0,"worker":"w1"}],"machinery":[],"models":[{"assignment":"BQ==","node":{"cube":[],"formula_sha256":"a8b2a31c8dd8ba69dd9f6b5e97792081572d2984d3ae40dcc4a6e40631427c98"},"record":{"journal":"5c4373aa6a0f0a7448fa58e69d36038618c7024f068d0d693254f01899a85cb0","seq":1}}],"not_admitted":[],"open":[{"node":{"cube":[],"formula_sha256":"83ef822c62746022fb52b0d52f6050c2f8a699e171512c9eb61356bda5d553d4"},"node_id":"5e1fff6f071fe019657a52a5fda90a3e08196d01524e7a157b70df624b676720","reason":null,"state":"pending"},{"node":{"cube":[],"formula_sha256":"a8b2a31c8dd8ba69dd9f6b5e97792081572d2984d3ae40dcc4a6e40631427c98"},"node_id":"32f9fbd9d8fd74e216f2fe77b03491948848c3a5555a1700c217f65ab18a0090","reason":null,"state":"model"}],"used_attempts":[],"verdict":"MODEL_FOUND"}
