{"anomalies":[],"campaign":"805589004d2ed7a54804bd0119466e76f264d65e218f86faaf70835a360147aa","format":"cubeproof-certificate-1","formula_open":[{"node":{"cube":[],"formula_sha256":"a8b2a31c8dd8ba69dd9f6b5e97792081572d2984d3ae40dcc4a6e40631427c98"},"node_id":"32f9fbd9d8fd74e216f2fe77b03491948848c3a5555a1700c217f65ab18a0090","reason":null,"state":"model"}],"formulas":[{"formula_sha256":"83ef822c62746022fb52b0d52f6050c2f8a699e171512c9eb61356bda5d553d4","key":"all3","proved":true,"roots":[{"closed":true,"cube":[],"summary":{"leaf_merkle_root":"0793c4159c7643ddabd7cc394e21aa7e2568e520190e2774ed8a1535969adefa","leaves":1,"max_cube_size":0,"splits":0}}],"summary":{"leaf_merkle_root":"0793c4159c7643ddabd7cc394e21aa7e2568e520190e2774ed8a1535969adefa","leaves":1,"max_cube_size":0,"splits":0}},{"formula_sha256":"a8b2a31c8dd8ba69dd9f6b5e97792081572d2984d3ae40dcc4a6e40631427c98","key":"sat3","proved":false,"roots":[{"closed":false,"cube":[],"summary":{"leaf_merkle_root":null,"leaves":0,"max_cube_size":0,"splits":0}}],"summary":{"leaf_merkle_root":null,"leaves":0,"max_cube_size":0,"splits":0}}],"journals":[{"bytes":5365,"head":"2459b71d5e0a201dc0dd50ceffff08e30a68bcaad07e43610b668f035f793a74","id":"5c4373aa6a0f0a7448fa58e69d36038618c7024f068d0d693254f01899a85cb0","records":4,"torn_tail_bytes":0,"worker":"w1"}],"machinery":[{"journal":"5c4373aa6a0f0a7448fa58e69d36038618c7024f068d0d693254f01899a85cb0","machinery":{"checker":{"path":"/opt/tools/bin/cake_lpr","sha256":"cb07a41e1dbd374a9ce87fb7860c564ac8e49659974253a61f9d96d3f338ef0f"},"cubeproof_sha256":"1077ed65075b150733b738cc8c5f44018162a7a7c023161dd928f5079c98f735","helper":null,"packages_sha256":"e5f20d42ac124c52b579e03661603ed3312b65548350b28285c905fe49e6ab11","runtime":{"image_digest":null,"libc":"glibc 2.39","platform":"linux-x86_64","python":"3.12.3"},"solver":{"argv":["--lrat"],"path":"/opt/tools/bin/cadical","sha256":"ed4d6e88b3adcaab6f51494a5c45b3a0d9d653dced766d1ad3d39fe00d907416","version":"1.9.5"},"source_manifest":[{"path":"cubeproof/__init__.py","sha256":"e6d1b76211276933852eb84dcab2f14504532eef4aaaac2a6e516aa8d7ffc3ae"},{"path":"cubeproof/evidence/certify.py","sha256":"4a402433c0bf4f920cd79ce3bf490d480a2a7fc78873742fb46b2967dc77cdd7"},{"path":"faces12_campaign/__init__.py","sha256":"ddeb9c4488790fd47bc51bb6a3613bd00c5aa4c8c3b93a44699d755d28d4b72e"},{"path":"neighbourly/__init__.py","sha256":"f1ec3bc0a9014c6ec5b92c85d776079ee5c74dc30327faffd4d09fbe3290d1eb"}],"unit_algorithm":"unit-v1"},"snapshot_seq":0}],"models":[{"assignment":"BQ==","node":{"cube":[],"formula_sha256":"a8b2a31c8dd8ba69dd9f6b5e97792081572d2984d3ae40dcc4a6e40631427c98"},"record":{"journal":"5c4373aa6a0f0a7448fa58e69d36038618c7024f068d0d693254f01899a85cb0","seq":2}}],"not_admitted":[],"open":[{"node":{"cube":[],"formula_sha256":"a8b2a31c8dd8ba69dd9f6b5e97792081572d2984d3ae40dcc4a6e40631427c98"},"node_id":"32f9fbd9d8fd74e216f2fe77b03491948848c3a5555a1700c217f65ab18a0090","reason":null,"state":"model"}],"used_attempts":[{"cnf_sha256":"83ef822c62746022fb52b0d52f6050c2f8a699e171512c9eb61356bda5d553d4","node":{"cube":[],"formula_sha256":"83ef822c62746022fb52b0d52f6050c2f8a699e171512c9eb61356bda5d553d4"},"node_id":"5e1fff6f071fe019657a52a5fda90a3e08196d01524e7a157b70df624b676720","proof_sha256":"7e54a099896bf5a556192146f217a67723f7a0bdec0d4022d6b475bff90d961b","record":{"journal":"5c4373aa6a0f0a7448fa58e69d36038618c7024f068d0d693254f01899a85cb0","seq":3},"route":"cdcl"}],"verdict":"MODEL_FOUND"}
