{"anomalies":[{"code":"check_rejected","info":{},"record":{"journal":"9b120856cbbcc4e7b6f25df7fecb9ea89c8b3c0cac8c5fa43d82e872bedfed61","seq":13}},{"code":"invalid_model","info":{"model_error":"missing"},"record":{"journal":"9b120856cbbcc4e7b6f25df7fecb9ea89c8b3c0cac8c5fa43d82e872bedfed61","seq":14}},{"code":"invalid_model","info":{"model_error":"conflicting"},"record":{"journal":"9b120856cbbcc4e7b6f25df7fecb9ea89c8b3c0cac8c5fa43d82e872bedfed61","seq":15}},{"code":"invalid_model","info":{"model_error":"out_of_range"},"record":{"journal":"9b120856cbbcc4e7b6f25df7fecb9ea89c8b3c0cac8c5fa43d82e872bedfed61","seq":16}},{"code":"invalid_model","info":{"model_error":"syntax"},"record":{"journal":"9b120856cbbcc4e7b6f25df7fecb9ea89c8b3c0cac8c5fa43d82e872bedfed61","seq":17}},{"code":"invalid_model","info":{"model_error":"violated"},"record":{"journal":"9b120856cbbcc4e7b6f25df7fecb9ea89c8b3c0cac8c5fa43d82e872bedfed61","seq":18}},{"code":"check_rejected","info":{},"record":{"journal":"9b120856cbbcc4e7b6f25df7fecb9ea89c8b3c0cac8c5fa43d82e872bedfed61","seq":23}},{"code":"check_rejected","info":{},"record":{"journal":"9b120856cbbcc4e7b6f25df7fecb9ea89c8b3c0cac8c5fa43d82e872bedfed61","seq":29}}],"campaign":"6bbdf19d39dd618713ca566001500c54a41a22ecac2e270c9a17fe6ad60ab0aa","format":"cubeproof-certificate-1","formula_open":[],"formulas":[{"formula_sha256":"83ef822c62746022fb52b0d52f6050c2f8a699e171512c9eb61356bda5d553d4","key":"all3","proved":true,"roots":[{"closed":true,"cube":[],"summary":{"leaf_merkle_root":"1b80911a1d6e88ff09040af6fe63e4e4f4770e0b1f0da613594041af8b8b694a","leaves":2,"max_cube_size":1,"splits":1}}],"summary":{"leaf_merkle_root":"1b80911a1d6e88ff09040af6fe63e4e4f4770e0b1f0da613594041af8b8b694a","leaves":2,"max_cube_size":1,"splits":1}}],"journals":[{"bytes":45374,"head":"72e4ea813e326a848b2af06647d8c0f5e648bd7a4d68ead4bf0033e1c7e1fdb9","id":"9b120856cbbcc4e7b6f25df7fecb9ea89c8b3c0cac8c5fa43d82e872bedfed61","records":31,"torn_tail_bytes":0,"worker":"w1"}],"machinery":[{"journal":"9b120856cbbcc4e7b6f25df7fecb9ea89c8b3c0cac8c5fa43d82e872bedfed61","machinery":{"checker":{"path":"/opt/tools/bin/cake_lpr","sha256":"cb07a41e1dbd374a9ce87fb7860c564ac8e49659974253a61f9d96d3f338ef0f"},"cubeproof_sha256":"1077ed65075b150733b738cc8c5f44018162a7a7c023161dd928f5079c98f735","helper":null,"packages_sha256":"e5f20d42ac124c52b579e03661603ed3312b65548350b28285c905fe49e6ab11","runtime":{"image_digest":null,"libc":"glibc 2.39","platform":"linux-x86_64","python":"3.12.3"},"solver":{"argv":["--lrat"],"path":"/opt/tools/bin/cadical","sha256":"ed4d6e88b3adcaab6f51494a5c45b3a0d9d653dced766d1ad3d39fe00d907416","version":"1.9.5"},"source_manifest":[{"path":"cubeproof/__init__.py","sha256":"e6d1b76211276933852eb84dcab2f14504532eef4aaaac2a6e516aa8d7ffc3ae"},{"path":"cubeproof/evidence/certify.py","sha256":"4a402433c0bf4f920cd79ce3bf490d480a2a7fc78873742fb46b2967dc77cdd7"},{"path":"faces12_campaign/__init__.py","sha256":"ddeb9c4488790fd47bc51bb6a3613bd00c5aa4c8c3b93a44699d755d28d4b72e"},{"path":"neighbourly/__init__.py","sha256":"f1ec3bc0a9014c6ec5b92c85d776079ee5c74dc30327faffd4d09fbe3290d1eb"}],"unit_algorithm":"unit-v1"},"snapshot_seq":0},{"journal":"9b120856cbbcc4e7b6f25df7fecb9ea89c8b3c0cac8c5fa43d82e872bedfed61","machinery":{"checker":{"path":"/opt/tools/bin/cake_lpr","sha256":"cb07a41e1dbd374a9ce87fb7860c564ac8e49659974253a61f9d96d3f338ef0f"},"cubeproof_sha256":"1077ed65075b150733b738cc8c5f44018162a7a7c023161dd928f5079c98f735","helper":null,"packages_sha256":"e5f20d42ac124c52b579e03661603ed3312b65548350b28285c905fe49e6ab11","runtime":{"image_digest":null,"libc":"glibc 2.39","platform":"linux-x86_64","python":"3.12.3"},"solver":{"argv":["--lrat"],"path":"/opt/tools/bin/cadical","sha256":"ed4d6e88b3adcaab6f51494a5c45b3a0d9d653dced766d1ad3d39fe00d907416","version":"1.9.5"},"source_manifest":[{"path":"cubeproof/__init__.py","sha256":"e6d1b76211276933852eb84dcab2f14504532eef4aaaac2a6e516aa8d7ffc3ae"},{"path":"cubeproof/evidence/certify.py","sha256":"4a402433c0bf4f920cd79ce3bf490d480a2a7fc78873742fb46b2967dc77cdd7"},{"path":"faces12_campaign/__init__.py","sha256":"ddeb9c4488790fd47bc51bb6a3613bd00c5aa4c8c3b93a44699d755d28d4b72e"},{"path":"neighbourly/__init__.py","sha256":"f1ec3bc0a9014c6ec5b92c85d776079ee5c74dc30327faffd4d09fbe3290d1eb"}],"unit_algorithm":"unit-v1"},"snapshot_seq":21}],"models":[],"not_admitted":[],"open":[],"used_attempts":[{"cnf_sha256":"bdb7d1b534a516cb5ba9b34c2f82396f19feddeaba73a693b0c89125d9679b7a","node":{"cube":[-1],"formula_sha256":"83ef822c62746022fb52b0d52f6050c2f8a699e171512c9eb61356bda5d553d4"},"node_id":"0f4b60b4b09acc164ecf08dd5002af63b39c42b4fcfc0ad427669b694e324387","proof_sha256":"d8f273e0f3f9501cd37821f32ceed2c868cff45ccfea095d2c12d84bf1f84b41","record":{"journal":"9b120856cbbcc4e7b6f25df7fecb9ea89c8b3c0cac8c5fa43d82e872bedfed61","seq":22},"route":"cdcl"},{"cnf_sha256":"26655321063bbc05f39d094ac442a6232b71074b27c11537354e3be78d8f86d2","node":{"cube":[1],"formula_sha256":"83ef822c62746022fb52b0d52f6050c2f8a699e171512c9eb61356bda5d553d4"},"node_id":"95757059a8564a7fddcbc2d3bff92b5425a2e31ec57681f863fc70f3fbc286ae","proof_sha256":"c9eef15cda251cba4c14a22cf698cfb03ecbf133fd3286e649cfc6ded389c428","record":{"journal":"9b120856cbbcc4e7b6f25df7fecb9ea89c8b3c0cac8c5fa43d82e872bedfed61","seq":20},"route":"cdcl"}],"verdict":"PROVED"}
