{"anomalies":[],"campaign":"15fbc018c1ad7fe5245313ab017624f8010442989b9f0dbc9d4c23211a875eae","format":"cubeproof-certificate-1","formula_open":[],"formulas":[{"formula_sha256":"ac42a371b5a124286c410ed5dfa2e3be7ee7d5b1feac6f08e7e1715f0c3669a8","key":"unsat","proved":true,"roots":[{"closed":true,"cube":[],"summary":{"leaf_merkle_root":"eea51d3597277387c6bb5fab34d9f9f1631bcbfc7a501b6a8cda597172d93490","leaves":2,"max_cube_size":1,"splits":1}}],"summary":{"leaf_merkle_root":"eea51d3597277387c6bb5fab34d9f9f1631bcbfc7a501b6a8cda597172d93490","leaves":2,"max_cube_size":1,"splits":1}}],"journals":[{"bytes":4887,"head":"3aa473f65036763b31e19d072df0c4a685fda2e0898ff71717b8c5e761671dc5","id":"50dae22c5ecdb5c240cc55e710df0477d181296f684d7e0a1255ed08e453e198","records":3,"torn_tail_bytes":0,"worker":"w1"}],"machinery":[{"journal":"50dae22c5ecdb5c240cc55e710df0477d181296f684d7e0a1255ed08e453e198","machinery":{"checker":{"path":"/opt/tools/bin/cake_lpr","sha256":"cb07a41e1dbd374a9ce87fb7860c564ac8e49659974253a61f9d96d3f338ef0f"},"cubeproof_sha256":"1077ed65075b150733b738cc8c5f44018162a7a7c023161dd928f5079c98f735","helper":null,"packages_sha256":"e5f20d42ac124c52b579e03661603ed3312b65548350b28285c905fe49e6ab11","runtime":{"image_digest":null,"libc":"glibc 2.39","platform":"linux-x86_64","python":"3.12.3"},"solver":{"argv":["--lrat"],"path":"/opt/tools/bin/cadical","sha256":"ed4d6e88b3adcaab6f51494a5c45b3a0d9d653dced766d1ad3d39fe00d907416","version":"1.9.5"},"source_manifest":[{"path":"cubeproof/__init__.py","sha256":"e6d1b76211276933852eb84dcab2f14504532eef4aaaac2a6e516aa8d7ffc3ae"},{"path":"cubeproof/evidence/certify.py","sha256":"4a402433c0bf4f920cd79ce3bf490d480a2a7fc78873742fb46b2967dc77cdd7"},{"path":"faces12_campaign/__init__.py","sha256":"ddeb9c4488790fd47bc51bb6a3613bd00c5aa4c8c3b93a44699d755d28d4b72e"},{"path":"neighbourly/__init__.py","sha256":"f1ec3bc0a9014c6ec5b92c85d776079ee5c74dc30327faffd4d09fbe3290d1eb"}],"unit_algorithm":"unit-v1"},"snapshot_seq":0}],"models":[],"not_admitted":[],"open":[],"used_attempts":[{"cnf_sha256":"9c3a297e17c04e18dedfdcea9a92ef36d28bb13d3d22a7fb610c76dc5733a5c5","node":{"cube":[1],"formula_sha256":"ac42a371b5a124286c410ed5dfa2e3be7ee7d5b1feac6f08e7e1715f0c3669a8"},"node_id":"8613aa54a13aae4c261e06a716c2f174ebe2e51271735157c3d748b109750c84","proof_sha256":"1f25d7efb5cdf5d9748055339cca0d2c735eab1f99d30f14aff01d2a50f5d8f3","record":{"journal":"50dae22c5ecdb5c240cc55e710df0477d181296f684d7e0a1255ed08e453e198","seq":1},"route":"unit"},{"cnf_sha256":"e00ff6d0e386d952b9f29ad13ca9358047c87ac60d2de0600282e9a49b80380b","node":{"cube":[-1],"formula_sha256":"ac42a371b5a124286c410ed5dfa2e3be7ee7d5b1feac6f08e7e1715f0c3669a8"},"node_id":"e786a0bab7f94b78db069e8e3f4e42ec6b671af257b5eaf4a17b74c576be1f9f","proof_sha256":"b5c0a80b27ce9372ef174b5ef0e34da5559b2bed3859b998f10b19828129ffd7","record":{"journal":"50dae22c5ecdb5c240cc55e710df0477d181296f684d7e0a1255ed08e453e198","seq":2},"route":"unit"}],"verdict":"PROVED"}
