{"anomalies":[],"campaign":"6bbdf19d39dd618713ca566001500c54a41a22ecac2e270c9a17fe6ad60ab0aa","format":"cubeproof-certificate-1","formula_open":[{"node":{"cube":[-1],"formula_sha256":"83ef822c62746022fb52b0d52f6050c2f8a699e171512c9eb61356bda5d553d4"},"node_id":"0f4b60b4b09acc164ecf08dd5002af63b39c42b4fcfc0ad427669b694e324387","reason":null,"state":"pending"},{"node":{"cube":[1,2],"formula_sha256":"83ef822c62746022fb52b0d52f6050c2f8a699e171512c9eb61356bda5d553d4"},"node_id":"a6c396b2bee289fc402100f50e75f841b4e8a69465a710ad08022d67d44c2f51","reason":"memory","state":"resource_blocked"},{"node":{"cube":[1,-2],"formula_sha256":"83ef822c62746022fb52b0d52f6050c2f8a699e171512c9eb61356bda5d553d4"},"node_id":"b36aee826a09e45c7ce38ee92835cb8120da9c498bf527d9f19892eb5420ad4f","reason":"tool_retries","state":"tool_blocked"}],"formulas":[{"formula_sha256":"83ef822c62746022fb52b0d52f6050c2f8a699e171512c9eb61356bda5d553d4","key":"all3","proved":false,"roots":[{"closed":false,"cube":[],"summary":{"leaf_merkle_root":null,"leaves":0,"max_cube_size":0,"splits":0}}],"summary":{"leaf_merkle_root":null,"leaves":0,"max_cube_size":0,"splits":0}}],"journals":[{"bytes":3257,"head":"f191543d19aa1a8c8afec585b2ec7f78bac65b97b927580f082bfcf0cc1417c3","id":"952515ef9987f811414b2e946c76257c6f911e9a4923f24f930452692e02762a","records":3,"torn_tail_bytes":0,"worker":"w2"},{"bytes":6006,"head":"f0e5be7ab3d9e9bfd616452fcb17e7a1074beab9765dfc4d36884ce777e43da5","id":"9b120856cbbcc4e7b6f25df7fecb9ea89c8b3c0cac8c5fa43d82e872bedfed61","records":9,"torn_tail_bytes":0,"worker":"w1"}],"machinery":[],"models":[],"not_admitted":[],"open":[{"node":{"cube":[-1],"formula_sha256":"83ef822c62746022fb52b0d52f6050c2f8a699e171512c9eb61356bda5d553d4"},"node_id":"0f4b60b4b09acc164ecf08dd5002af63b39c42b4fcfc0ad427669b694e324387","reason":null,"state":"pending"},{"node":{"cube":[1,2],"formula_sha256":"83ef822c62746022fb52b0d52f6050c2f8a699e171512c9eb61356bda5d553d4"},"node_id":"a6c396b2bee289fc402100f50e75f841b4e8a69465a710ad08022d67d44c2f51","reason":"memory","state":"resource_blocked"},{"node":{"cube":[1,-2],"formula_sha256":"83ef822c62746022fb52b0d52f6050c2f8a699e171512c9eb61356bda5d553d4"},"node_id":"b36aee826a09e45c7ce38ee92835cb8120da9c498bf527d9f19892eb5420ad4f","reason":"tool_retries","state":"tool_blocked"}],"used_attempts":[],"verdict":"OPEN"}
