{"anomalies":[{"code":"check_rejected","info":{},"record":{"journal":"7b876e65b6f849339609b6322b897f412bfcdb2a3c93358e8b66c5bfee423a1b","seq":4}},{"code":"invalid_model","info":{"model_error":"violated"},"record":{"journal":"ccf61dfbbce2ab1fdc85eee35a56ef4947a9ecf01c65c429efaee66900ddefe7","seq":3}}],"campaign":"805589004d2ed7a54804bd0119466e76f264d65e218f86faaf70835a360147aa","format":"cubeproof-certificate-1","formula_open":[{"node":{"cube":[],"formula_sha256":"83ef822c62746022fb52b0d52f6050c2f8a699e171512c9eb61356bda5d553d4"},"node_id":"5e1fff6f071fe019657a52a5fda90a3e08196d01524e7a157b70df624b676720","reason":null,"state":"pending"},{"node":{"cube":[],"formula_sha256":"a8b2a31c8dd8ba69dd9f6b5e97792081572d2984d3ae40dcc4a6e40631427c98"},"node_id":"32f9fbd9d8fd74e216f2fe77b03491948848c3a5555a1700c217f65ab18a0090","reason":null,"state":"model"}],"formulas":[{"formula_sha256":"83ef822c62746022fb52b0d52f6050c2f8a699e171512c9eb61356bda5d553d4","key":"all3","proved":false,"roots":[{"closed":false,"cube":[],"summary":{"leaf_merkle_root":null,"leaves":0,"max_cube_size":0,"splits":0}}],"summary":{"leaf_merkle_root":null,"leaves":0,"max_cube_size":0,"splits":0}},{"formula_sha256":"a8b2a31c8dd8ba69dd9f6b5e97792081572d2984d3ae40dcc4a6e40631427c98","key":"sat3","proved":false,"roots":[{"closed":false,"cube":[],"summary":{"leaf_merkle_root":null,"leaves":0,"max_cube_size":0,"splits":0}}],"summary":{"leaf_merkle_root":null,"leaves":0,"max_cube_size":0,"splits":0}}],"journals":[{"bytes":8109,"head":"ac48e114eafeb65fed380afe81331e12041b8bab0dc0d2fb788566f063ab8b8e","id":"7b876e65b6f849339609b6322b897f412bfcdb2a3c93358e8b66c5bfee423a1b","records":5,"torn_tail_bytes":0,"worker":"wbad"},{"bytes":6287,"head":"d697f5a2e302990a2baf77e97777cac7dab5de0d5df772cd9580fc4e90698c27","id":"ccf61dfbbce2ab1fdc85eee35a56ef4947a9ecf01c65c429efaee66900ddefe7","records":4,"torn_tail_bytes":0,"worker":"wsol"}],"machinery":[],"models":[{"assignment":"BQ==","node":{"cube":[],"formula_sha256":"a8b2a31c8dd8ba69dd9f6b5e97792081572d2984d3ae40dcc4a6e40631427c98"},"record":{"journal":"7b876e65b6f849339609b6322b897f412bfcdb2a3c93358e8b66c5bfee423a1b","seq":3}}],"not_admitted":[{"reason":"checker_not_admitted","record":{"journal":"7b876e65b6f849339609b6322b897f412bfcdb2a3c93358e8b66c5bfee423a1b","seq":1}},{"reason":"checker_not_admitted","record":{"journal":"7b876e65b6f849339609b6322b897f412bfcdb2a3c93358e8b66c5bfee423a1b","seq":2}},{"reason":"checker_not_admitted","record":{"journal":"7b876e65b6f849339609b6322b897f412bfcdb2a3c93358e8b66c5bfee423a1b","seq":3}},{"reason":"checker_not_admitted","record":{"journal":"7b876e65b6f849339609b6322b897f412bfcdb2a3c93358e8b66c5bfee423a1b","seq":4}},{"reason":"solver_not_admitted","record":{"journal":"ccf61dfbbce2ab1fdc85eee35a56ef4947a9ecf01c65c429efaee66900ddefe7","seq":1}},{"reason":"solver_not_admitted","record":{"journal":"ccf61dfbbce2ab1fdc85eee35a56ef4947a9ecf01c65c429efaee66900ddefe7","seq":2}},{"reason":"solver_not_admitted","record":{"journal":"ccf61dfbbce2ab1fdc85eee35a56ef4947a9ecf01c65c429efaee66900ddefe7","seq":3}}],"open":[{"node":{"cube":[],"formula_sha256":"83ef822c62746022fb52b0d52f6050c2f8a699e171512c9eb61356bda5d553d4"},"node_id":"5e1fff6f071fe019657a52a5fda90a3e08196d01524e7a157b70df624b676720","reason":null,"state":"pending"},{"node":{"cube":[],"formula_sha256":"a8b2a31c8dd8ba69dd9f6b5e97792081572d2984d3ae40dcc4a6e40631427c98"},"node_id":"32f9fbd9d8fd74e216f2fe77b03491948848c3a5555a1700c217f65ab18a0090","reason":null,"state":"model"}],"used_attempts":[],"verdict":"MODEL_FOUND"}
