{"anomalies":[],"campaign":"b5830d5b742ff9d1f7d976a272770d7e97863a0305f3f0f8323dfe79bd05e79a","format":"cubeproof-certificate-1","formula_open":[{"node":{"cube":[],"formula_sha256":"e160232d0ce8816f12ecdcdc7bb0e939b55fb5ca43414ae6077dfa3989655732"},"node_id":"632aabecdbaddb1300acffc38a7faa9b86cc44f362e96087952af30c0b4fb29f","reason":null,"state":"model"}],"formulas":[{"formula_sha256":"403402bd378554f90f91934470a1a456ffbbe37682cf9debc471fd0353dfdf9c","key":"clause","proved":true,"roots":[{"closed":true,"cube":[],"summary":{"leaf_merkle_root":"cb48f60a5e4ababbfb24c6df242fafea7236d84b14789ddf5d245abe132d4ebd","leaves":1,"max_cube_size":0,"splits":0}}],"summary":{"leaf_merkle_root":"cb48f60a5e4ababbfb24c6df242fafea7236d84b14789ddf5d245abe132d4ebd","leaves":1,"max_cube_size":0,"splits":0}},{"formula_sha256":"e160232d0ce8816f12ecdcdc7bb0e939b55fb5ca43414ae6077dfa3989655732","key":"empty","proved":false,"roots":[{"closed":false,"cube":[],"summary":{"leaf_merkle_root":null,"leaves":0,"max_cube_size":0,"splits":0}}],"summary":{"leaf_merkle_root":null,"leaves":0,"max_cube_size":0,"splits":0}}],"journals":[{"bytes":4589,"head":"1f3efecf8d1853312227fe444530f9349687165e65b39dda5f50501902338642","id":"5f11cbcf73331ece07a373c5cec21c4ea1d72cc85da9bf0fe088ef855394b583","records":3,"torn_tail_bytes":0,"worker":"w1"}],"machinery":[{"journal":"5f11cbcf73331ece07a373c5cec21c4ea1d72cc85da9bf0fe088ef855394b583","machinery":{"checker":{"path":"/opt/tools/bin/cake_lpr","sha256":"cb07a41e1dbd374a9ce87fb7860c564ac8e49659974253a61f9d96d3f338ef0f"},"cubeproof_sha256":"1077ed65075b150733b738cc8c5f44018162a7a7c023161dd928f5079c98f735","helper":null,"packages_sha256":"e5f20d42ac124c52b579e03661603ed3312b65548350b28285c905fe49e6ab11","runtime":{"image_digest":null,"libc":"glibc 2.39","platform":"linux-x86_64","python":"3.12.3"},"solver":{"argv":["--lrat"],"path":"/opt/tools/bin/cadical","sha256":"ed4d6e88b3adcaab6f51494a5c45b3a0d9d653dced766d1ad3d39fe00d907416","version":"1.9.5"},"source_manifest":[{"path":"cubeproof/__init__.py","sha256":"e6d1b76211276933852eb84dcab2f14504532eef4aaaac2a6e516aa8d7ffc3ae"},{"path":"cubeproof/evidence/certify.py","sha256":"4a402433c0bf4f920cd79ce3bf490d480a2a7fc78873742fb46b2967dc77cdd7"},{"path":"faces12_campaign/__init__.py","sha256":"ddeb9c4488790fd47bc51bb6a3613bd00c5aa4c8c3b93a44699d755d28d4b72e"},{"path":"neighbourly/__init__.py","sha256":"f1ec3bc0a9014c6ec5b92c85d776079ee5c74dc30327faffd4d09fbe3290d1eb"}],"unit_algorithm":"unit-v1"},"snapshot_seq":0}],"models":[{"assignment":"","node":{"cube":[],"formula_sha256":"e160232d0ce8816f12ecdcdc7bb0e939b55fb5ca43414ae6077dfa3989655732"},"record":{"journal":"5f11cbcf73331ece07a373c5cec21c4ea1d72cc85da9bf0fe088ef855394b583","seq":2}}],"not_admitted":[],"open":[{"node":{"cube":[],"formula_sha256":"e160232d0ce8816f12ecdcdc7bb0e939b55fb5ca43414ae6077dfa3989655732"},"node_id":"632aabecdbaddb1300acffc38a7faa9b86cc44f362e96087952af30c0b4fb29f","reason":null,"state":"model"}],"used_attempts":[{"cnf_sha256":"403402bd378554f90f91934470a1a456ffbbe37682cf9debc471fd0353dfdf9c","node":{"cube":[],"formula_sha256":"403402bd378554f90f91934470a1a456ffbbe37682cf9debc471fd0353dfdf9c"},"node_id":"c42b56dff36ea5cc780d446addfe92375941c37c6739f2bc2646eb3437c2c3ec","proof_sha256":"1f25d7efb5cdf5d9748055339cca0d2c735eab1f99d30f14aff01d2a50f5d8f3","record":{"journal":"5f11cbcf73331ece07a373c5cec21c4ea1d72cc85da9bf0fe088ef855394b583","seq":1},"route":"unit"}],"verdict":"MODEL_FOUND"}
