{"anomalies":[],"campaign":"ba8d16384d3f239cba7fbb97b51cacb45632d01df72eb312da0a72a842d3009d","format":"cubeproof-certificate-1","formula_open":[{"node":{"cube":[],"formula_sha256":"6642f3ff4fae6f869a53f303bc768802cec0a16af731686c6bf03f342cf0489e"},"node_id":"bba010ddf884dd18af95196ec9b38e3925cb710a07279341fc70d94afbf6e1f8","reason":null,"state":"pending"}],"formulas":[{"formula_sha256":"6642f3ff4fae6f869a53f303bc768802cec0a16af731686c6bf03f342cf0489e","key":"sat","proved":false,"roots":[{"closed":true,"cube":[-1],"summary":{"leaf_merkle_root":"a5b6cfcec4cdf10a99cf99db621974d0b069b3684a3168543e16fd7b9f7280db","leaves":1,"max_cube_size":1,"splits":0}}],"summary":{"leaf_merkle_root":null,"leaves":0,"max_cube_size":0,"splits":0}}],"journals":[{"bytes":3606,"head":"f95ef8bad31a33a163cab69abc7e437d635cde1a316b084070f6b7a30acc1f55","id":"2a9763cf9a7dc4367f7a152c0f11901ea4841fa43d8795f47dc250db52fc2927","records":2,"torn_tail_bytes":0,"worker":"w1"}],"machinery":[{"journal":"2a9763cf9a7dc4367f7a152c0f11901ea4841fa43d8795f47dc250db52fc2927","machinery":{"checker":{"path":"/opt/tools/bin/cake_lpr","sha256":"cb07a41e1dbd374a9ce87fb7860c564ac8e49659974253a61f9d96d3f338ef0f"},"cubeproof_sha256":"1077ed65075b150733b738cc8c5f44018162a7a7c023161dd928f5079c98f735","helper":null,"packages_sha256":"e5f20d42ac124c52b579e03661603ed3312b65548350b28285c905fe49e6ab11","runtime":{"image_digest":null,"libc":"glibc 2.39","platform":"linux-x86_64","python":"3.12.3"},"solver":{"argv":["--lrat"],"path":"/opt/tools/bin/cadical","sha256":"ed4d6e88b3adcaab6f51494a5c45b3a0d9d653dced766d1ad3d39fe00d907416","version":"1.9.5"},"source_manifest":[{"path":"cubeproof/__init__.py","sha256":"e6d1b76211276933852eb84dcab2f14504532eef4aaaac2a6e516aa8d7ffc3ae"},{"path":"cubeproof/evidence/certify.py","sha256":"4a402433c0bf4f920cd79ce3bf490d480a2a7fc78873742fb46b2967dc77cdd7"},{"path":"faces12_campaign/__init__.py","sha256":"ddeb9c4488790fd47bc51bb6a3613bd00c5aa4c8c3b93a44699d755d28d4b72e"},{"path":"neighbourly/__init__.py","sha256":"f1ec3bc0a9014c6ec5b92c85d776079ee5c74dc30327faffd4d09fbe3290d1eb"}],"unit_algorithm":"unit-v1"},"snapshot_seq":0}],"models":[],"not_admitted":[],"open":[],"used_attempts":[{"cnf_sha256":"ac42a371b5a124286c410ed5dfa2e3be7ee7d5b1feac6f08e7e1715f0c3669a8","node":{"cube":[-1],"formula_sha256":"6642f3ff4fae6f869a53f303bc768802cec0a16af731686c6bf03f342cf0489e"},"node_id":"18796a9597fda9332afd8d55e9bc55e5ef6a6047eb765afb6fa5a2ec49d4893a","proof_sha256":"1f25d7efb5cdf5d9748055339cca0d2c735eab1f99d30f14aff01d2a50f5d8f3","record":{"journal":"2a9763cf9a7dc4367f7a152c0f11901ea4841fa43d8795f47dc250db52fc2927","seq":1},"route":"unit"}],"verdict":"OPEN"}
